{
  "$schema": "https://json-schema.org/draft/2020-12/schema",
  "$id": "urn:xpointlabs:deep-survival:program-manifest:1",
  "title": "Deep Survival Program Manifest",
  "type": "object",
  "additionalProperties": false,
  "required": [
    "$schema",
    "schemaVersion",
    "programId",
    "release",
    "status",
    "approvedAt",
    "accountableOwner",
    "canonicalProgram",
    "documentSet",
    "machineSpecificationSet",
    "inventoryBaseline",
    "workPackageIdPattern",
    "packagePolicy"
  ],
  "properties": {
    "$schema": { "const": "../../schemas/program-manifest.schema.json" },
    "schemaVersion": { "const": "1.0.0" },
    "programId": { "const": "deep-survival" },
    "release": { "type": "string", "pattern": "^\\d+\\.\\d+\\.\\d+$" },
    "status": {
      "enum": [
        "draft",
        "approved-local-execution",
        "paused",
        "superseded"
      ]
    },
    "approvedAt": { "type": "string", "format": "date" },
    "accountableOwner": { "const": "Mr. X" },
    "canonicalProgram": { "type": "string", "minLength": 1 },
    "decisionRecord": { "type": "string", "minLength": 1 },
    "documentSet": {
      "type": "object",
      "additionalProperties": false,
      "required": ["algorithm", "entryFormat", "documentCount", "sha256"],
      "properties": {
        "algorithm": { "const": "SHA-256" },
        "entryFormat": { "const": "<lowercase-file-sha256><two-spaces><forward-slash-relative-path><LF>" },
        "documentCount": { "type": "integer", "minimum": 1 },
        "sha256": { "type": "string", "pattern": "^[a-f0-9]{64}$" }
      }
    },
    "machineSpecificationSet": {
      "type": "object",
      "additionalProperties": false,
      "required": ["algorithm", "entryFormat", "artifactCount", "sha256", "paths"],
      "properties": {
        "algorithm": { "const": "SHA-256" },
        "entryFormat": { "const": "<lowercase-file-sha256><two-spaces><forward-slash-repo-relative-path><LF>" },
        "artifactCount": { "const": 12 },
        "sha256": { "type": "string", "pattern": "^[a-f0-9]{64}$" },
        "paths": {
          "type": "array",
          "minItems": 12,
          "maxItems": 12,
          "uniqueItems": true,
          "items": { "type": "string", "pattern": "^(?:docs|scripts)/[A-Za-z0-9._/-]+$" }
        }
      }
    },
    "inventoryBaseline": {
      "type": "object",
      "additionalProperties": false,
      "required": ["algorithm", "path", "sha256", "tag"],
      "properties": {
        "algorithm": { "const": "SHA-256" },
        "path": { "const": "inventory/session-production-boundaries.v1.json" },
        "sha256": { "type": "string", "pattern": "^[a-f0-9]{64}$" },
        "tag": { "const": "legacy-session-baseline-v3.0.0" }
      }
    },
    "workPackageIdPattern": { "type": "string", "minLength": 1 },
    "dependencyManifestSchema": { "type": "string", "minLength": 1 },
    "dependencyManifestPathTemplate": { "type": "string", "minLength": 1 },
    "packagePolicy": { "type": "string", "minLength": 1 },
    "executionPolicy": {
      "type": "object",
      "additionalProperties": false,
      "properties": {
        "localOnly": { "const": true },
        "localDockerAllowed": { "const": true },
        "pushAllowed": { "const": false },
        "externalPublishAllowed": { "const": false },
        "externalDeployAllowed": { "const": false }
      }
    }
  }
}
