{
    "$schema":  "../../schemas/program-manifest.schema.json",
    "schemaVersion":  "1.0.0",
    "programId":  "deep-survival",
    "release":  "3.0.0",
    "status":  "approved-local-execution",
    "approvedAt":  "2026-08-11",
    "accountableOwner":  "Mr. X",
    "canonicalProgram":  "DEEP-NATIVE-CLEAN-BREAK-RU.md",
    "decisionRecord":  "../../decisions/DR-0003-deep-native-session-clean-break.md",
    "documentSet":  {
                        "algorithm":  "SHA-256",
                        "entryFormat":  "\u003clowercase-file-sha256\u003e\u003ctwo-spaces\u003e\u003cforward-slash-relative-path\u003e\u003cLF\u003e",
                        "documentCount":  6,
                        "sha256":  "bf20a19400c01ae98ac69d3e90f811c2a12cc8e25b2b4af7414eb2bfd1a91c70"
                    },
    "machineSpecificationSet":  {
                                    "algorithm":  "SHA-256",
                                    "entryFormat":  "\u003clowercase-file-sha256\u003e\u003ctwo-spaces\u003e\u003cforward-slash-repo-relative-path\u003e\u003cLF\u003e",
                                    "artifactCount":  12,
                                    "sha256":  "eac720244172bde4ae069a9aac34e38ce8b01a07ae4e91f7db86b4621d78086b",
                                    "paths":  [
                                                  "docs/survival-program/releases/v3.0.0/specs/dnp1-classical-v1.evidence-attestation.schema.json",
                                                  "docs/survival-program/releases/v3.0.0/specs/dnp1-classical-v1.evidence-manifest.schema.json",
                                                  "docs/survival-program/releases/v3.0.0/specs/dnp1-classical-v1.evidence-ownership.json",
                                                  "docs/survival-program/releases/v3.0.0/specs/dnp1-classical-v1.evidence-ownership.schema.json",
                                                  "docs/survival-program/releases/v3.0.0/specs/dnp1-classical-v1.evidence-selftest-result.json",
                                                  "docs/survival-program/releases/v3.0.0/specs/dnp1-classical-v1.evidence-source-snapshot.json",
                                                  "docs/survival-program/releases/v3.0.0/specs/dnp1-classical-v1.registry.json",
                                                  "docs/survival-program/releases/v3.0.0/specs/dnp1-classical-v1.registry.schema.json",
                                                  "docs/survival-program/releases/v3.0.0/specs/dnp1-classical-v1.vectors.schema.json",
                                                  "docs/survival-program/releases/v3.0.0/specs/dnp1-classical-v1.vectors.skeleton.json",
                                                  "scripts/check-dnp1-classical-spec.ps1",
                                                  "scripts/dnp1-evidence-selftest-runner.ps1"
                                              ]
                                },
    "inventoryBaseline":  {
                              "algorithm":  "SHA-256",
                              "path":  "inventory/session-production-boundaries.v1.json",
                              "sha256":  "db67e1afd75afb7918fd7465e9b6876fa401df75ff8f8aeeef7c892f8a05132a",
                              "tag":  "legacy-session-baseline-v3.0.0"
                          },
    "workPackageIdPattern":  "^DNP1-(?:GOV|INV|SPEC|PROTO|CLIENT|NODE|OPS|SEC)(?:-[a-z0-9]+)*$",
    "dependencyManifestSchema":  "deep-devops/schemas/survival/dependency-manifest.schema.json",
    "dependencyManifestPathTemplate":  "deep-devops/manifests/deep-native/\u003cwave\u003e/\u003cwork-package-id\u003e.json",
    "packagePolicy":  "../../PACKAGE-POLICY.md",
    "executionPolicy":  {
                            "localOnly":  true,
                            "localDockerAllowed":  true,
                            "pushAllowed":  false,
                            "externalPublishAllowed":  false,
                            "externalDeployAllowed":  false
                        }
}
